[
  {
    "slug": "ecommerce-vetronaviglio",
    "name": "Ecommerce Vetronaviglio",
    "phase": "Esecuzione (MVP)",
    "state": "blocked",
    "last_commit": "21f4239",
    "last_commit_relative": "7 giorni fa",
    "next_action": "Attendere riscontro da Bettina/Federico dopo il giro sul sito aggiornato.",
    "revenue_eur": 0,
    "costs_eur": 0,
    "margin_eur": 0,
    "invoice_count": 0,
    "ledger_status": "template-only",
    "commercial_risk": "high",
    "priority": "medium"
  },
  {
    "slug": "vetronaviglio-report-visite",
    "name": "Vetronaviglio Report Visite",
    "phase": "Esecuzione (live)",
    "state": "blocked",
    "last_commit": "6472618",
    "last_commit_relative": "4 mesi fa",
    "next_action": "Incontro con Federico Rosi per validare prototipo e ottenere credenziali L:",
    "revenue_eur": null,
    "costs_eur": null,
    "margin_eur": null,
    "invoice_count": 0,
    "ledger_status": "template-only",
    "commercial_risk": "high",
    "priority": "medium"
  },
  {
    "slug": "vetronaviglio-cartiglio-automation",
    "name": "Vetronaviglio Cartiglio Automation",
    "phase": "Esecuzione",
    "state": "active",
    "last_commit": "a083f22",
    "last_commit_relative": "10 settimane fa",
    "next_action": "Confermare layout del cartiglio CRISTAL 100 FEA 15 overlay",
    "revenue_eur": null,
    "costs_eur": null,
    "margin_eur": null,
    "invoice_count": 0,
    "ledger_status": "template-only",
    "commercial_risk": "high",
    "priority": "medium"
  },
  {
    "slug": "magie-su-excel",
    "name": "Magie su Excel",
    "phase": "Da consegnare",
    "state": "active",
    "last_commit": "509af4d",
    "last_commit_relative": "4 mesi fa",
    "next_action": "Inviare a Margherita Colombo il file `docs/elenco fornitoriconemail.xlsx` e la bozza email in `docs/project/email-colombo-fornitori.md`. Attendere feedback per recuperare i contatti dei 43 fornitori mancanti.",
    "revenue_eur": null,
    "costs_eur": null,
    "margin_eur": null,
    "invoice_count": 0,
    "ledger_status": "template-only",
    "commercial_risk": "high",
    "priority": "medium"
  },
  {
    "slug": "zetabytenexus-website",
    "name": "Zetabytenexus Website",
    "phase": "Live",
    "state": "active",
    "last_commit": "869269d",
    "last_commit_relative": "17 ore fa",
    "next_action": "Produrre `docs/leads/zetabytenexus-website-positioning.md` con @marketing, poi `pricing.md` con @pricing",
    "revenue_eur": null,
    "costs_eur": null,
    "margin_eur": null,
    "invoice_count": 0,
    "ledger_status": "template-only",
    "commercial_risk": "high",
    "priority": "medium",
    "overview_note": "../opencode-config/docs/obsidian/Progetto zetabytenexus-website – Overview.md",
    "docs_path": "/data/workspace/Progetti/zetabytenexus-website/docs"
  },
  {
    "slug": "analisi-bollette",
    "name": "Analisi Bollette",
    "phase": "Manutenzione",
    "state": "active",
    "last_commit": "1089fe4",
    "last_commit_relative": "6 settimane fa",
    "next_action": "Nessun passo bloccante. Scegli nuova funzionalità o finalizza placeholder footer.",
    "revenue_eur": null,
    "costs_eur": null,
    "margin_eur": null,
    "invoice_count": 0,
    "ledger_status": "template-only",
    "commercial_risk": "medium",
    "priority": "medium"
  },
  {
    "slug": "gestione_spese_famiglia",
    "name": "Gestione Spese Famiglia",
    "phase": "Manutenzione",
    "state": "active",
    "last_commit": "311ce02",
    "last_commit_relative": "13 giorni fa",
    "next_action": "[TEST DASHBOARD] Verificare prossima esecuzione cron job per confermare sincronizzazione email funzionante",
    "revenue_eur": null,
    "costs_eur": null,
    "margin_eur": null,
    "invoice_count": 0,
    "ledger_status": "template-only",
    "commercial_risk": "medium",
    "priority": "medium"
  },
  {
    "slug": "vetronaviglio-tracking-mvp",
    "name": "Vetronaviglio Tracking MVP",
    "phase": "Esecuzione (live)",
    "state": "active",
    "last_commit": "a489ca4",
    "last_commit_relative": "18 ore fa",
    "next_action": "1. Bottone \"Sync DHL\" in dashboard — oggi solo FedEx ha il Sync button; valutare con utente se serve anche per DHL",
    "revenue_eur": 10200,
    "costs_eur": 0,
    "margin_eur": 10200,
    "invoice_count": 1,
    "ledger_status": "operativo",
    "commercial_risk": "low",
    "priority": "medium",
    "overview_note": "../opencode-config/docs/obsidian/Progetto vetronaviglio-tracking-mvp – Overview.md",
    "docs_path": "/data/workspace/Progetti/vetronaviglio-tracking-mvp/docs"
  },
  {
    "slug": "vetronaviglio-listini-webapp",
    "name": "Vetronaviglio Listini Webapp",
    "phase": "Da avviare",
    "state": "pending",
    "last_commit": "9318a5b",
    "last_commit_relative": "22 ore fa",
    "next_action": "Inoltrare la bozza email a Federico Rosi (draft Gmail personale `r2340419766766766437`) e cancellare la vecchia bozza `r-1809523374683032986`.",
    "revenue_eur": null,
    "costs_eur": null,
    "margin_eur": null,
    "invoice_count": 0,
    "ledger_status": "template-only",
    "commercial_risk": "medium",
    "priority": "high",
    "overview_note": "../opencode-config/docs/obsidian/Progetto vetronaviglio-listini-webapp – Overview.md",
    "docs_path": "/data/workspace/Progetti/vetronaviglio-listini-webapp/docs"
  },
  {
    "slug": "triathlon-planner-saas",
    "name": "Triathlon Planner SaaS",
    "phase": "Manutenzione",
    "state": "active",
    "last_commit": "c79eee9",
    "last_commit_relative": "12 giorni fa",
    "next_action": "Promuovere gratuitamente la app alle società di triathlon italiane.",
    "revenue_eur": null,
    "costs_eur": null,
    "margin_eur": null,
    "invoice_count": 0,
    "ledger_status": "template-only",
    "commercial_risk": "medium",
    "priority": "medium",
    "overview_note": "../opencode-config/docs/obsidian/Progetto Triathlon Planner SaaS – Overview.md",
    "docs_path": "/data/workspace/Progetti/triathlon-planner-saas/docs"
  },
  {
    "slug": "nuovo-sito-vetronaviglio",
    "name": "Nuovo Sito Vetronaviglio",
    "phase": "Da avviare",
    "state": "pending",
    "last_commit": "8ee7aa3",
    "last_commit_relative": "21 giorni fa",
    "next_action": "Decidere se il catalogo Excel va committato nel repo o gestito come asset esterno. Prossima sessione: verificare integrazione dati con il sito (WooCommerce o frontend custom).",
    "revenue_eur": null,
    "costs_eur": null,
    "margin_eur": null,
    "invoice_count": 0,
    "ledger_status": "template-only",
    "commercial_risk": "medium"
  },
  {
    "slug": "agis-lab",
    "name": "Agis Lab",
    "phase": "Da avviare",
    "state": "pending",
    "last_commit": "a29795f",
    "last_commit_relative": "16 ore fa",
    "next_action": "1) Inviare la risposta a Viviano — testo canonico revisionato da Stefano il 13/10 in `docs/leads/email-viviano-riscontro-censimento.md`; bozza Gmail `r4308153319261737619` con i 3 allegati XLSX (scartare `r8056852964389109805`). Prima dell'invio: (a) 4 correzioni di rilettura (vedi Note operative del file: spazio «risultano sulla», trattini punto 2, frase impianto elettrico da validare, «matrice licenze»); (b) confermare se «Prossimo passo» (call + modulo standard) resta eliminato; (c) mittente `s.bonfanti@vetronaviglio.it`. Dopo l'invio: data in `docs/leads/index.md` + changelog. Nessun invio automatico. Seconda bozza pronta e indipendente: `docs/leads/risposta-viviano-software-postazioni.md`, da inviare a mano quando si ritiene opportuno.",
    "revenue_eur": null,
    "costs_eur": null,
    "margin_eur": null,
    "invoice_count": 0,
    "ledger_status": "template-only",
    "commercial_risk": "medium"
  }
]
